,created_utc,title,num_comments,total_awards_received,author
0,1643547170,"Woke up with 300k Minereum in my wallet. No price associated, can’t trade. Help explain what’s going on!",0,0,Bagong420
1,1643512644,Convert minereum BSC (MNEB) to bnb binance coin on your trust wallet | free Airdrop | crypto airdrop,0,0,crytoloover
2,1643477524,"Minereum Genesis address for sale bsc 150,000 . Just make me an offer",0,0,jdubb9688
3,1643428170,How To Claim 1lack MNEB Coin tamil | free airdrops tamil | trust wallet airdrop | instant withdrawal,0,0,crytoloover
4,1643396181,Minereum Coin Going Up 151.49% | Crypto Rocket Launch Plus News | MetaVice | PlayFuel | Rogue Doge |,0,0,crytoloover
5,1643292710,"How to Add Minereum BSC on trust wallet and get worth of 150,000 MNB",0,0,crytoloover
6,1643279922,My mneb experience.,0,0,mirfaisal
7,1643148760,Swap your minereum to BNB immediately,0,0,nollypay
8,1643148588,How to swap minereum to BNB smartchain,1,0,nollypay
9,1643148476,How to swap minereum,0,0,nollypay
10,1643148378,How to swap minereum to BNB,0,0,nollypay
11,1643056018,"How to claim $8,500 worth of MINEREUM into your trustwallet and swap it. legitimate or fake?",0,0,crytoloover
12,1642960247,Koinly income overstated because of some scam token that was deposited into my Binance Smart Chain account called MNEB? (x-post from /r/Cryptocurrency),0,0,ASICmachine
13,1642959840,Koinly income overstated because of some scam token that was deposited into my Binance Smart Chain account called MNEB?,3,0,Pickinanameainteasy
14,1642884629,Koinly income overstated because of some scam token that was deposited into my Binance Smart Chain account called MNEB?,1,0,Pickinanameainteasy
15,1642876247,"32000 Minereum Coinbase Wallet For Sale, 50$ Equal in any Crypto in Top100 For One Wallet ! Also Have Coonbase wallet With Ten Different ETH Wallets And All of them With 32000 MNE. Who Pays 300$ will Receive 10 Wallets 32000 MNE! #MNE #Crypto #sale #eth",0,0,Standardgroup
16,1642870969,MNEB &amp; MNEP Token Free for all Trust wallet and Token Pocket Wallet Owners🤪,0,0,myselfvkrathi
17,1642870946,MNEB &amp; MNEP Token Free for all Trust wallet and Token Pocket Wallet Owners🤪,0,0,myselfvkrathi
18,1642817708,Solved! How to sell or swap Minereum using Trust Wallet ( MNE or MNEB),0,0,crytoloover
19,1642793801,"📜 Minereum Airdrop is live 📅 Airdrop end date: January 29, 2022 🚀 Distributing after the end 🏆 Total $30,000 USD 🎁 Reward : 30$ USD 👫 You need to invite 10 friends to get 1 bonus ticket 30$ Don’t forget to: 🔸Complete all the tasks 🔸Submit all the details 🔗Your personal referral link: https",0,0,kuryliuk10
20,1642656276,Is Minereum BSC (MNEB) a scam?,0,0,Psychological-Nail-6
21,1642619150,Help!,1,0,dudicslevente
22,1642558745,Minereum just made me happy,0,0,nathanwalid
23,1642545284,150000 MNEB airdropped,1,0,wwent222
24,1642533310,How to sell Minereum BSC Token MNEB Using PancakeSwap On Trust Wallet OR MetaMask Wallet,0,0,crytoloover
25,1642522922,"I have some unique tax questions about reflections, air dropped scam coins, ETH--&gt;ETH2.0 conversion, etc. -- could someone help me out?",0,0,paulrudder
26,1642522709,I have some tax questions...,4,0,paulrudder
27,1642436971,MNEB in my wallet,0,0,superuser79
28,1642398935,"300,000 MNEP Airdop??",1,0,jackoffnotrades
29,1642396894,Minereum legit or scam?,1,0,jackoffnotrades
30,1642390451,How to sell minereum bsc on trust wallet at pancakes swap,0,0,crytoloover
31,1642387905,Is it possible to sell MNEB minerum??,1,0,Tim22Mt
32,1642387384,How come you can’t sell MNEB minerum??,1,0,Tim22Mt
33,1642350308,"Minereum $mne Chart, Price and Contract",0,0,crytoloover
34,1642277754,Was just sent some Minereum MNEP to my coinbase wallet. A little nervous,0,0,Agitated-Midnight416
35,1642277699,How do I withdraw from Coinbase wallet?,1,0,SpaghettiMafia69
36,1642276624,I was just sent Minereum MNEP into my coinbase wallet. A little nervous,2,0,Agitated-Midnight416
37,1642275807,Was just sent Minereum MNEP to my CB Wallet,1,0,Agitated-Midnight416
38,1642199291,[WTS] Crazy Discounted 2x Minereum Wallets For 100$!!(down from 300) Details inside,3,0,FsWorx
39,1642199016,[WTS] Crazy Discounted 2x Auto Mining lvl 3 Minereum Wallets For 100$!!(down from 300) Details inside,0,0,FsWorx
40,1642198586,[WTS] Crazy Discounted 2x Minereum Wallets For 100$!!(down from 300) Details inside,0,0,FsWorx
41,1642198538,[WTS] Crazy Discounted 2x Minereum Wallets For 100$!!(down from 300) Details inside,0,0,FsWorx
42,1642128408,[WTS] Selling 2x Lvl3 Genesis Minereum Wallets (erc-20) Extreme Fraction Discount Plus 700 Free Available Tokens (61k Total remaining),1,0,FsWorx
43,1642125663,Selling 2x Lvl3 Genesis Minereum Wallets (Import),0,0,FsWorx
44,1642046766,how to with withdraw minereum bsc on trust wallet,0,0,crytoloover
45,1641967665,how to withdraw minereum bsc from trust wallet,0,0,crytoloover
46,1641665542,Need BSC for fee? Is there a faucet?,1,0,AnakAbba
47,1641388101,How to remove scam coins from wallet?,1,0,YDGOMAM
48,1641346545,Free Claim $6400 MNEB airdrop in your trustwallet.,0,0,crytoloover
49,1641226234,How To Withdraw MNEB Coin Trust Wallet | MNEB Withdrawal Process | Watch Till End - TCZ,0,0,crytoloover
50,1641091467,How to Sell Minereum BSC on TRUST Wallet,0,0,crytoloover
51,1641074894,"How to get 150,000 minereum",0,0,Jace_5654
52,1641074610,"150,000 minereum",0,0,Jace_5654
53,1641074546,"150,000 minereum",0,0,Jace_5654
54,1641074276,"How to get 150,000 minereum.",0,0,Jace_5654
55,1640917525,Bot in Ether address,0,0,Asleep_Persimmon_283
56,1640719703,Some Strange token Airdroped to my wallet like #Def8.io #Art #Mneb #Mgas now what should I do with these token?,0,0,Amin_Matin
57,1640470460,You could now get 150000 minereum worth $5000 if you visit minereum page through Google,0,0,Jace_5654
58,1640458752,"selling my trust wallet account. I don’t know how to transfer my 150,000 MNEB to USD without Binance.US &amp; my Binace account is not working I’ll sell it for half my pro-folio If anyone is willing to buy it",0,0,Designer_Dirt4243
59,1640426727,MNEB,0,0,Gemzxy
60,1640267094,How to you turn minereum into bitcoin in the trust wallet app?,0,0,hambooger_helper
61,1640225708,How And Where To Buy Minereum (MNE) - Step By Step Guide,0,0,CryptooGuide
62,1640210343,Withdraw your MNEB,0,0,General-Bit-8286
63,1640199134,(Mods can delete when I get help) just noticed I have this random coin I never bought. (Minereum) and it’s worth quite a bit I won’t try selling it of course. But how would I tell the difference of dust vs maybe someone sending it to my wallet on mistake. Thanks for the help.,1,0,Specific-Dress7813
64,1640073288,🙋Trust Wallet New Airdrop Explained In Telugu | MNEB Token Fake Or Not InTelugu | 🔥🔥🔥,0,0,crytoloover
65,1640000407,Mneb,0,0,Godstime_1
66,1639821076,Minereum BSC $MNEB Trading,0,0,Mr_Owura
67,1639820914,MNEB Trading,0,0,Mr_Owura
68,1639813677,"15,000 Minereum BSC (MNEB) Free Airdrop Claim. No any fees required",0,0,pvrcrypto
69,1639788330,How to remove scam coins from wallet?,1,0,nbreddit999
70,1639773280,Minereum (MNEB) is officially a SCAM 🚨⚠️,1,0,almahdi_313
71,1639767620,"150,000 Minereum in Trust Wallet",0,0,Porshe667
72,1639733109,HOW TO SELL MINEREUM BSC AIRDROP IN TRUST WALLET🔥| MNEB UPDATE TAMIL,0,0,crytoloover
73,1639726248,Minereum or MinereSCAM,0,0,Popular_Analyst_9101
74,1639693453,How to buy Minereum BSC Token on Trust Wallet - Pancakeswap,0,0,crytoloover
75,1639646702,"GET $8000😳How To Withdraw MNEB Token #MNEB Token withdraw kaise Kare,Trust Wallet MNEB Token Airdrop",0,0,crytoloover
76,1639617854,How To Buy/Sell Minereum BSC (MNEB) on Trust Wallet 💰| How To Buy/Sell (MNEB) Token on pancakeswap,0,0,crytoloover
77,1639562466,Russians just earned an equivalent of U.S. debt with Minereum,0,0,richiehustle
78,1639523605,What is difference between minereum compared to minereum bsc,0,0,Mr-Walkdown
79,1639517407,"Who want's my 150,000 Minereum bsc tokens ?",0,0,Harley_FLHX
80,1639516240,Be aware of this scam!,1,0,namepatrik
81,1639515648,I got airdropped a scam token (150k mneb) on July and now it's the token has $22k value on koinly which makes my gains wrong. How can I fix this?,0,0,lil_devel7
82,1639510289,I got randomly 150.000 mneb and idk how to swap or sell it need some help,0,0,heinaga1989
83,1639510268,I got randomly 150.000 mneb and idk how to swap or sell it need some help,0,0,Budget_Sympathy_5209
84,1639509911,How to Buy Minereum BSC Token (MNEB) Using PancakeSwap On Trust Wallet OR MetaMask Wallet,0,0,crytoloover
85,1639509873,i got randomly 150.000 mneb and idk how to swap or sell it,0,0,Budget_Sympathy_5209
86,1639505928,"Selling 150,000 mneb and my wallet for 2 BNB for serious ppl only!",0,0,almahdi_313
87,1639497818,I buy minereum,0,0,richardmille2
88,1639494677,[Question] MNEB update,1,0,Berthalozious
89,1639493528,Minereum BSC,1,0,Expert-Oven891
90,1639492265,Minereum has value now?,0,0,SanityKiller289
91,1639491026,How did Minerium (One of the most well-known Airdrop scams) able to be listed on CMC?,0,0,LebornVsMikeShinoda
92,1639490090,MNEB token Update 🤑🤑 || 5000$ Profit Everyone?? 🤑🤑 || MNEB listed on pancakeswap🤑🤑 || Can we sell? 🤑,0,0,crytoloover
93,1639483670,Minereum,0,0,ggrey99
94,1638867292,"WALLET FOR SALE, DON'T HAVE NETWORK FEE TO TRANSFER MINEREUM WORTH OF $2500 TO ANY CENTRALIZED EXCHANGE TO SELL,",0,0,R3tr0_Gig
95,1638851093,How I Can Sell MNEB Airdrop,0,0,Gurvir_
96,1638817153,WALLET TRADE,0,0,R3tr0_Gig
97,1638376349,I want minereum,2,0,Unhappy_Tax_5930
98,1638057757,Minerem Wallets for Sale,3,0,Radial_Storm
99,1637763806,"Do not touch any coins that suddenly appear in your wallet, especially if they look like they're worth a lot, and no, this isn't about dust attacks",0,0,Zealousideal_Ride_27
100,1637745077,"Do not touch any coins that suddenly appear in your wallet, especially if they look like they're worth a lot, and no, this isn't about dust attacks",849,0,AutisticDalekOnSpeed
101,1637730182,You should never import a seed phrase you randomly found online,57,0,AutisticDalekOnSpeed
102,1637420735,Giving out recovary phrase on telegram group scam,2,0,datapim
103,1636896085,Scam the Scammer ?,10,0,Marcaday_
104,1636508421,I lost my USD200 to an ongoing Trust Wallet Scam,5,0,Critical-Pay-510
