,created_utc,title,num_comments,total_awards_received,author
0,1626538874,Another hack story,20,0,waicestmoi
1,1626477852,TEL Crypto: Why Telcoin Is Trending in Search Today,8,0,Serious_Level_8701
2,1625950966,Plian $PI is TOP 15 coins by LunarCRUSH Galaxy Score Galaxy Score is a proprietary score that is constantly measuring crypto against itself with respect to the community metrics pulled in from across the web $DEXT $FLOW $ROYA $AMP $YFI $XTZ $ALGO $TEL $AVA $EXRD $PI $CHR $HBAR $SAND $THETA,0,0,ehab23
3,1625841700,"The Hateful Eight: TEL, CELO, HBAR, VET, DOGE, ICP, QTUM, XLM — Biggest Losers from July 2nd to July 9th",13,0,bench4rench
4,1625517169,Telcoin raises $10Million in pre-series A finance equity,2,0,csantini91
5,1625433187,"Today I invested $26000 in shitcoins exclusively. I will post an update how it goes in 3 months, if I dare.",1472,0,unprotextor
6,1625414217,Taxes on staked earnings?,5,0,mikey9214
7,1625277329,Anyone else buy a coin with legit flaws that they just love anyway?,1,0,HelicopterLate6115
8,1625271584,How to tel if a wallet is time locked?,2,0,bcampb10
9,1625266753,Went skydiving today,26,0,jessi387
10,1625165023,"Telcoin raises US$10M, launches next generation of fintech platform",3,0,SunriseFan99
11,1625117858,Should I stick to investing in $ADA or switch to $TEL like my friend keeps suggesting?,0,0,NickMtz123
12,1625117403,Should I stick with $ADA or switch to $TEL like my friend suggest?,0,0,NickMtz123
13,1625091101,Finally TELCOIN V3 🥳📈,3,0,yassinox12
14,1625087714,Introducing Telcoin V3,21,0,s0mexguy
15,1624650882,I’ll invest in whatever you tel me to…,2,0,Embarrassed-Ad134
16,1624246490,TelCoin,1,0,JayDa68W
17,1624130917,Telcoin Price Prediction 2021 – Will TEL Hit $0.5 Soon?,11,0,ShondraRiemann
18,1623998607,Is Telcoin the future of global remittances?,2,0,MicrowaveManTEL
19,1623968853,TELCOIN,2,0,MicrowaveManTEL
20,1623968763,Telcoin V3 End of Month,2,0,MicrowaveManTEL
21,1623968720,Telcoin,2,0,MicrowaveManTEL
22,1623873015,Crypto: Tel Aviv - Event Tomorrow,2,0,[deleted]
23,1623823483,Telcoin is about to change the market,4,0,ErmmJerr
24,1623735944,Telcoin. Buy now or get left behind.,6,0,torontxo
25,1623669530,Personal story about a METAMASK SCAM going around! Please be Careful!,196,6,dystoxin
26,1623628926,Telcoin hopefully being adopted by more regional banks across the US.,22,0,WhatWeDoInLife
27,1623627993,Telcoin Bank Deal Rumours growing.,0,0,WhatWeDoInLife
28,1623322013,Crypto nowhere near ready for mass adoption....,1,0,Bmanashe
29,1623286061,"#Shiba 7 Day volume is more than; Uniswap, Sushiswap, Pancakeswap, Solana, VechainKusama, Telcoin, Curve, Avax, Terra, and many more big names 🐕🐕🐕🙌🏼🙌🏼🙌🏼💎💎💎🚀🚀🚀🤑🤑🤑",2,0,Only_Ad_6749
30,1623266990,Telcoin roadmap,2,0,markl12000
31,1623209397,Big News for Telcoin,1,0,Liamc325
32,1623208502,Telcoin enters new markets ahead of V3 launch,1,0,ErmmJerr
33,1623208015,Telcoin opens up on 24 new platforms in 16 different countries,0,0,ErmmJerr
34,1623206877,Telcoin press release,2,0,markl12000
35,1622801698,Telcoin,2,0,sudocoin
36,1622798903,Telcoin $TEL - Send Money Smarter.,0,0,sudocoin
37,1622734198,"Help me understand some Crypto mysteries, please!",2,0,Dry_Tortuga_Island
38,1622628256,"Telcoin is the best Performer of the Last 90 days, congrats 🎊",3,0,airforceaaron
39,1622373357,"Telcoin, TEL will hit $1 this year",2,0,rex9m
40,1622288674,Anyone surprised to see lack of coverage $TEL is getting on subs like r/cryptocurrency,0,0,MicrowaveManTEL
41,1622143362,Tel last 90 days performance against all Alts,3,0,DragonTau_
42,1622068662,Bullish news for crypto and TELCOIN,0,0,Irishcav104
43,1622053510,"LB 649 passes, granting Telcoin the charter to start the first DeFi bank.",2,0,Cryptix001
44,1622029853,Telcoin-drafted crypto banking legislation signed into law in Nebraska,1,0,Reddy-16
45,1622017712,TEL made it to Yahoo Finance!! 🚀 💎,1,0,times-exceptions
46,1622017563,TEL made it to Yahoo Finance!! 🚀💎,2,0,times-exceptions
47,1622009542,TELCOIN🚀🚀🚀,2,0,Fast_Pace99
48,1622003207,Landmark Legislation Passed for Digital Assets!,2,0,quantumbets
49,1621863531,"Money, the technology, and A question on Tel",12,0,AwkwardGremlin
50,1621834129,"The most helpful thread we could have at this moment, when everything is a ""fire sale"" is one that breaks down the VERY best Alt Coin to buy cheap. Whether it be LINK, ADA, ALGO, GRT, TEL, FTM, ICP, TRIAS, ROSE, Etc. The community would benefit for well researched and fact based replies.",42,0,Tha_Dude_Abidez
51,1621629234,Tel Coin - currently at .27..possible hidden gem,4,0,Veddy86
52,1621616235,Are you scared? A different POV from Canada,28,0,Rusty_Charm
53,1621454125,How do I add $TEL to Metamask,2,0,BroadAbbreviations8
54,1621454069,Help me with a new wrinkle - $TEL to Metamask low fees,2,0,BroadAbbreviations8
55,1621356564,Celo vs Telcoin,2,0,uscsamiam
56,1621312767,TEL/USDT is going to moon today 🚀,3,0,DrinkKnown
57,1621306369,Story time for the new kids who joined us recentlyon the crypto scene and arn't feeling so sure and positive right now...,9,0,dothepropellor
58,1621252167,Which coins should I invest in??? Or is it better to diversify??? 🤔🤔🤔,1,0,Dstrada94
59,1621248149,If u were to invest your last 100$ available what coin would you choose from the following?,54,0,HiddenknifeX
60,1621142128,"TEL/USDT token on KuCoin app is one of the most undervalued gems I have ever seen. It’s mind blowing that nobody knows about this coin and it has so many signed partnerships, compliance passed, and use cases that I just had to share!",3,0,DrinkKnown
61,1621121832,The future of Polygon (MATIC) - DISCUSSION,3,0,nothing_important123
62,1621103055,"$10000 - TEL, IOTA, ETH or BTC?",47,0,holyredbeard
63,1621009101,"[OC] TO ALL THE PEOPLE PANIC SELLING (specially new ones in the cryptospace), THIS IS WHY YOU HODL! - bought Telcoin in 2018, set a target and LITERALLY forgot about it. An old friend calls me and tells me Telcoin had exploded, I woke up today to 7x - HODL! HODL! HODL!",16,0,FZIdeas
64,1621008480,"[OC] TO ALL THE PEOPLE PANIC SELLING (specially new ones in the cryptospace), THIS IS WHY YOU HODL! - bought Telcoin in 2018, set a target and LITERALLY forgot about it. An old friend calls me and tells me Telcoin had exploded, I woke up today to 7x - HODL! HODL! HODL!",6,0,FZIdeas
65,1620877317,Help a noob you future millionaires,1,0,tarun_grrg
66,1620837539,Telcoin- completely slept on.....you’re welcome.,2,0,Thearcngel
67,1620832607,"This place, and the daily thread, is becoming a little too obsessed with ethereum.",10,0,Gwranger
68,1620826105,Why does it feel like knowone is talking about tel coin? Massive gains in the past 2 weeks.,2,0,tombola201uk
69,1620762045,"Any of these worth holding? TEL, ZRX, MIOTA, ICX?",6,0,holyredbeard
70,1620741415,Telcoin Takes Aim at World's Largest Remittance Corridor in Mexico,6,0,Donnie_77
71,1620691571,Telcoin news!,0,0,SteveTabs
72,1620683981,Telcoin,2,0,Adventurous_Leg244
73,1620683818,TELcoin,2,0,Adventurous_Leg244
74,1620683727,Telcoin,10,0,tombola201uk
75,1620682731,you guys should do some research on $tel 👀,2,0,goodluckgeniee
76,1620680040,Telcoin,2,0,tombola201uk
77,1620669698,Guys please have a look at telcoin it have a lot of potentiel,2,0,DarthvaderDHL
78,1620667761,For those who lost on Doge and need a new coin,12,0,friendandmachine
79,1620667139,"If you haven’t checked out telcoin yet, you should.",2,0,TerribleCoconut2020
80,1620664112,Just got in crypto. I have some questions. I hope it helps other beginners also. Thanks in advance.,13,0,tarun_grrg
81,1620628182,"Honest opinions on BTT, and TEL?",2,0,jbrumm97
82,1620619785,Telcoin?,2,0,splitter995
83,1620618543,Telcoin a Buy?,2,0,EdwardIsDaGod
84,1620580002,"Top Three Weekend Gainers: ARRR, MATIC, and TEL",0,0,manus101010
85,1620563817,Most underrated Alt coin?,6,0,Jamie-w23
86,1620544851,"$2k to invest, rookie mistakes",31,0,tinyfutureengineer
87,1620533449,International Suicide Hotline Numbers - Seek help if you need it.,129,0,Dad_Of_Dachshund
88,1620429977,#telcoin,2,0,willylanee
89,1620425865,"Small caps - BAX, MTV, or TEL?",2,0,HulaDanger
90,1620416481,telcoin making waves?,2,0,taxscrub
91,1620362610,Telcoin,1,0,Cooke628383
92,1620362536,Telcoin,2,0,Cooke628383
93,1620359791,Telcoin has just launched...,2,0,Bec_Drayton
94,1620333488,Telcoin,2,0,ReventoN617
95,1620330799,Old Coins Being Resurrected - What to do?,7,0,where-ya-headed
96,1620328378,How I made 30x trading cryptos,1,0,I-just-wanna-play
97,1620328335,How can I buy Tel coin in Canada? I guess in kucoin verification it shows us to use driving license instead of canada?,2,0,Pretending-Geek
98,1620300541,tel,1,0,Fluid-Pick2753
99,1620300471,TEL,2,0,Fluid-Pick2753
100,1620300231,TEL ... telcoin this ones from the gods,2,0,Fluid-Pick2753
101,1620295097,How do I Buy Telcoin?,19,0,IRBLT
102,1620284781,Why is Telcoin going parabolic last few days?,10,0,asta-bre
103,1620281065,Are there other gems like Telcoin?,2,0,DepartFromEvil
104,1620280511,How to buy $Telcoin,0,0,Nano2theMOOn
105,1620274156,"100k challenge. Get 100k minimum telcoin while it’s still cheap, and HODL to $1. 1100 (now $3000) investment into 100k just like Matic.",1,0,Delicious-Ad598
106,1620273860,Swapped pundix for telcoin,2,0,hannah21202
107,1620268192,Telcoin (TEL) gains 300% after layer-2 migration to the Polygon network,15,0,HecstarLord
108,1620265491,Telcoin announces big news — Nebraska Financial Innovation Act clearing committee,3,0,ErmmJerr
109,1620262698,Telcoin announces big news - Nebraska Financial Innovation Act clearing committee!,3,0,ErmmJerr
110,1620256123,Telcoin for noobs?,2,0,Help__Im_lost
111,1620245157,Thoughts on TELcoin?,2,0,Spzrta
112,1620221812,$tel telcoin,2,0,goodluckgeniee
113,1620218537,Telcoin Potential,7,0,Joshd30
114,1620207786,"How well have your coins performed since 1 January 2021, and which still have plenty of headroom for the remainder of this bull run",0,0,Dreampopgazer
115,1620174450,Telcoin,1,0,Hostican123
116,1620132252,Any thoughts on tel coin bought some a month ago and so far it’s gaining some serious steady profit.,2,0,snori995
117,1619933430,The real Satoshi Nakamoto,11,0,Acceptable-Sort-8429
118,1619904324,TEL boost as V3 release nears!,2,0,ErmmJerr
119,1619887022,Telcoin on Twitter (TEL) - What do you guys think of this project? I just bought 42k TEL,0,0,k_grinolds
120,1619880461,Telcoin markets are live on Quickswap - Can someone hold my hand on this?,4,0,kjarkr
121,1619841134,The real Satoshi Nakamoto,6,0,Acceptable-Sort-8429
122,1619801581,The real Satoshi Nakamoto,18,0,Acceptable-Sort-8429
123,1619796221,Is Telcoin Creating the Holy Grail of Crypto Wallets?,17,0,Top-Professor-1664
124,1619787611,DAG or Telcoin,2,0,antoRL4
125,1619608618,Telcoin.,2,0,Tuscans1977
126,1619257010,Telcoin,2,0,FinesseKingz514
127,1619113035,Telcoin,0,0,MicrowaveManTEL
128,1619112837,If You Haven’t Heard of $TEL Yet... 🙌🏼💎,2,0,MicrowaveManTEL
129,1619104173,How can you say $tel is a shit coin!?,0,0,migijc123
130,1619012905,Can You tell me your opinions on Telcoin /$TEL. Good or Bad I want to hear you out!,2,0,migijc123
131,1618919420,My portfolio feedback,41,0,montanajr27
132,1618883831,Crypto Gem - Oracle for Polkadot (Get in early - less than $100M market cap),5,0,ElCrypToro
133,1618803513,"Was wondering if you guys knew the best app to purchase some Telcoin and Vechain.Seems like all the apps I come across have abysmal reviews.Im currently using coinbase,but they don't offer those two coins.",2,0,Senseisimms
134,1618763177,Best solution for long holding a mixture of assets,8,0,montanajr27
135,1618735310,I like telcoin,3,0,Optimal-Ad5380
136,1618695264,Telcoin - New Gem? Did we miss the big news?,0,0,in_jail_out_verysoon
137,1618665871,New Big Telcoin Update V3 comming,4,0,Emorikan
138,1617903155,Beginner looking for trading strategy &amp; portfolio management advice,1,0,goldentrez
139,1617571992,Most people make me feel crazy for talking about Crypto,34,0,2001boy
140,1617563172,TEL coin is going to change lifes soon..,1,0,[deleted]
141,1617562709,TEL coin going to change lives and life style in the near future,1,0,[deleted]
142,1617470668,Problem with 2FA&gt;SMS on Binance US &amp; not receiving verification code. Help?,12,0,11111111010001100110
143,1616892953,Dent Wireless is waking up in the crypto world,3,0,Milner-co
144,1615843054,Buying $Tel in Canada,0,0,jmacdon32
145,1615825659,Telcoin / rocksolid 🙌,0,0,servantnic711
146,1615805230,"Telcoin: Hypes, or HODLs?",14,0,ObsoleteGentile
147,1615522656,Before and after $TEL over 400%,0,0,Shr00MN00B6
148,1615477885,"GCash (largest mobile money wallet in the Philippines), advertising the use of Telcoin!",0,0,dystoxin
149,1615427943,Telcoin ???,0,0,Ok-Original-964
150,1614714744,Telcoin GCash remittance is live,0,0,Emorikan
151,1614288400,"With only $4,000 to invest, how should you split up your portfolio?",181,0,darkwombat45
152,1614241884,Telcoin CEO spoke to Nebraska Legislatures about turning Nebraska into a decentralized finance hub.,0,0,dronestar45
153,1614187724,How do you guys like Tel coin,0,0,Thecryptoeinstein
154,1613103186,Mastercard x Telcoin... A Thread,0,0,__CaptainMorgan
155,1613004862,"Filecoin $FIL Telcoin $TEL Cryptocurrency Altcoin Review February 11th, ... PURELY EDUCATIONAL",0,0,krynetixx
156,1612887998,New coin $TEL,0,0,Envy3521
157,1612883501,Telcoin - NOT a pump and dump,0,0,spartacus07869
158,1612853110,Telcoin is about to explode if it hasn't already,16,0,darkwombat45
159,1612853026,Telcoin is about to explode if it hasn't already,0,0,darkwombat45
160,1612381839,How do you feel about NEO?,78,2,freakydeku
161,1612363513,TEL : Woo ! Been hodling since Feb 2018. Finally back in the black today ! Up 65% so far today.,2,0,iuseallthebandwidth
162,1612224176,Thoughts on $TEL?,0,0,No_Wallaby_5516
163,1612208580,Telcoin,0,0,thin_disguise
164,1612049330,List of Suicide Hotlines WorldWide - Mental Health is Important!,21,0,Lapadus
165,1612037619,Telcoin looks to take on Western Union as crypto for remittances abroad.,0,0,Dog_Dad_Bod
166,1611980004,Telcoin releases V2 and the volume is exploding!,5,0,BigAssMistske
167,1611976728,Telcoin just went live. Project looks to be making good progress.,0,0,KYCATS24
168,1610199185,"Y'all be sleepin on TEL, just sayin",4,0,naterza2
169,1609804563,Traditional Remittances vs Telcoin,0,0,naterza2
