,created_utc,title,num_comments,total_awards_received,author
245,1623986430,💎TITAN was just updated on pancake a minute ago 💎Liquidty locked forever 📷,0,0,Dangerous-Slide-4812
246,1623984541,Why is TTN Titan coin up over 1000% in a day?,2,0,sorebody
247,1623984221,Why is TTN Titan coin up over 1000% in a day?,2,0,sorebody
248,1623976565,Mark Cuban 'Hit' by Titan Crypto Crash As Coin's Price Falls to Near Zero - this is why you ALWAYS need to do your own research and understand what you’re buying! Looking for a 💎 In the rough? Don’t spend what you can’t afford to loose!,50,0,PeacockMamba
249,1623963191,"Considering what went on with $TITAN, what's the best strategy to approach yield farming?",2,0,factstony
250,1623959978,$65 to $0 - The 24 hours that killed TITAN! Everyone is well aware of the volatilit... #Hours #killed #TITAN #All_Alt_Coin https://thecryptonewsweb.com/65-to-0-the-24-hours-that-killed-titan/?feed_id=5101&amp;_unique_id=60cba9a953def,0,0,nj_crypto_news
251,1623958776,Report from the Lemonade Stand on the Moon - 6/17/2021,4,0,unholyfire
252,1623954999,People mindlessly regurgitating that Iron Finance was a rug pull without doing in diligence in understanding what happened is going to hurt the crypto community through misinformation,35,0,theNeumannArchitect
253,1623953863,The Meltdown of some people over the TITAN/IRON thing is why we tell people to not invest more thatn they can.,61,0,robinhood1596
254,1623948731,Video just after Mark Cuban got rugpulled (2018),20,0,makba
255,1623948395,Titan holders may get reimbursed🙏❤️🤷🏻‍♀️,8,0,jodraco
256,1623945321,"So, what actually happened on that TITAN thing?",15,0,nevetando
257,1623943021,Crash of the Titan!,4,0,[deleted]
258,1623941848,$65 to $0 – The 24 hours that killed TITAN!,0,0,jjaymay29
259,1623941557,Iron Finance was NOT a rugpull,137,0,RandomPlayerCSGO
260,1623934071,"Damn… Titan Token goofed up big time got rekt so hard, it went from ATH to 0 real quick 💯",10,0,Yeokk123
261,1623927393,Attack on Titan,4,0,[deleted]
262,1623927312,ATTACK ON TITAN,2,0,[deleted]
263,1623926650,"The ""bankrun"" that hapenned to TITAN, can it happen to USDT (Tether) too?",52,0,Sjors22-
264,1623925740,This is why you don't invest more than you can and do your DD,57,0,robinhood1596
265,1623924371,5-8% apm staking?,53,0,ninjaklan
266,1623923665,"Got Too Greedy, Just Paid The Price For It.",713,5,IHateElon
267,1623917174,Gain porn on Titan,2,0,Kind_Strike
268,1623915294,Iron Finance's Titan Token Falls to Near Zero in DeFi Panic Sell,40,0,SolidusViper
269,1623913534,Check Out These Wallet Addresses Selling and Buying TITAN!,16,0,JonSnow781
270,1623904827,the fall of TITAN/Iron.finance from the perspective of a small ape,175,1,BAndABro
271,1623904689,Is buying and holding TITAN around ATH knowing it will dip 50% diamond hands or is it pure retardation?,0,0,Elighttice
272,1623904529,Is buying and holding TITAN around ATH knowing it will dip diamond hands enough or is it pure retardation?,0,0,[deleted]
273,1623901173,TITAN IS A HODL BOIS! 250k by JULY!,82,1,Thecoinjerk
274,1623891675,"Matic, Titan &amp; Iron. LOL. Huge rug pull worse than even shit coins. I have never seen such a crash since bitconnect scam.",96,0,BrokenShield
275,1623888886,"The IRON peg to $1USD has failed, TITAN price crashes.",128,0,lukeroge
276,1623886007,Matic Network grinding to a halt due to defi flash crash.,99,0,Otahyoni
277,1623882113,"Mark Cuban experiences his first rug pull! Titan crashed from $60 to $2. If you see 50,000% APYs, you should to be doubting it's legitimacy, not aping in.",2230,5,DetroitMotorShow
278,1623831091,Media Titan Fox Launches $100M Fund for Newly-Launched NFT Studio,2,0,[deleted]
279,1623763894,Question on Token Rebalances and Impermanent Loss,16,0,iCOMMAi_Salem
280,1623671118,a boring social experiment with ERC20,161,0,ChemicalSalamander52
281,1623654172,"Titan looks like a pretty good setup, it could very well run $TTNP 💎🙌🏻",0,0,[deleted]
282,1623580414,IRON FINANCE Becomes Top Ten Stablecoin! $TITAN,1,0,ClassActionLawyerUSA
283,1622823450,Hardware wallet question,6,0,ngneer_ns
284,1622661200,What hardware wall is the best???,3,0,BY0707
285,1622463103,"If Your Using An Exchange, Get a Hardware Key (Not Wallet)",24,0,delvo14827
286,1622139399,"The recent weeks, one-two punch, has changed crypto forever.",19,0,Ghoest9
287,1622037515,Titan Announces Industry First Cryptocurrency Capital Management Solution for All - Titan's cryptocurrency offering will be the first and only actively managed portfolio of cryptocurrency assets available to all U.S. investors.,3,0,K4Kerala
288,1622034701,Titan Announces Industry First Cryptocurrency Capital Management Solution for All,2,0,Ap3X_GunT3R
289,1621792648,If you joined crypto atleast 4 months ago you are officially apart of history.,278,0,BanjosRuleDude
290,1621650487,"Ellipal titan, thoughts?",3,0,BasedJayyy
291,1621643614,Is the Ellipal titan a good wallet?,2,0,BasedJayyy
292,1621595326,Beginner question about staking and cold wallets.,1,0,gotaburner
293,1621512755,"Quit my job at Cisco, now I rhyme about crypto",13,0,NASA_Lies
294,1621472741,Cold wallet with smartphone management?,1,0,Stonk_Trooper
295,1620905583,Titan Coin!,0,0,OilAggressive3544
296,1620905487,Titan Coin!,2,0,OilAggressive3544
297,1620870620,Cold wallet with smart phone management?,3,0,Stonk_Trooper
298,1620771515,The worlds reserve currency should be independent from governments or organisations. Here’s why.,25,0,Delam2
299,1620492047,US based crypto exchanges with the best customer service?,1,0,LeftieMusic
300,1620307548,Cold wallet with smartphone management,2,0,Stonk_Trooper
301,1620117396,Why Bitcoin is condemned to die in the long term,10,0,Khaikaa
302,1619930339,Hardware wallets 2021... Anything noteworthy coming up?,4,0,crypt0kiddie
303,1619740433,Bitcoin Titan MicroStrategy Reports Major Growth In First Quarter,8,0,Ocilla
304,1619491591,Hip Hop Titan Eminem Announced an NFT Collection,6,0,FireFromtheHorizon
305,1619415623,"Best use for a Windows PC - i9, 64gb RAM, dual NVidia Titan XPs",2,0,ryanasdo
306,1619415067,"Best use of a Windows PC? - Core i9, 64 GB RAM, Dual Nvidia Titan XPs. I can run it 24/7 has unlimited internet bandwidth, what’s the best thing to do with it? Miner program, start a node for any specific coin, run multiple miners (1 cpu, 1 gpu). Curious any recommendations vs having it mostly idle?",2,0,ryanasdo
307,1619387852,Wondering if I can get a solid answer on the Ellipal Titan,1,0,WhoSmokesThaBlunts
308,1619072821,Financial Titan Fidelity Reveals Bitcoin &amp; Crypto Adoption Among Institutional Investors on the Rise,5,0,The-Crypto-Portal
309,1616886280,Bitcoin Price x2 Double Your BTC Moon Bitcoin Live; Must Read! All You Need to Know,2,0,Ok_Nefariousness4542
310,1615899694,Investment Titan Howard Marks admits his initial response to bitcoin was a 'knee-jerk reaction'; Turns Bullish On Bitcoin,1,0,WaggishNickel
311,1613756878,Chinese Car Titan Geely Announces Move Into Blockchain,1,0,ResponsibleAd9086
312,1613388939,TTN,0,0,lenzgraf66
313,1613388575,TTN,0,0,lenzgraf66
314,1613337509,Google Titan Security Key,0,0,wassefkamal
315,1612807561,BITCOIN just OVERTOOK FACEBOOK to become the 8th LARGEST ASSET by Market Capitalization Globally!!!,122,0,stokednsteezy
316,1612137067,To the newbies: doge is shit,846,15,volatileutopia
317,1612036833,"Visa May Add Cryptocurrencies to Its Payments Network, Says CEO",5,0,BlackRussianTV
318,1610767929,Titan Received Investment from Coinbase Venture,0,0,Intelligent-Elk-8642
319,1610740981,Titan Secures Strategic Investment from Coinbase Ventures,2,0,DaVibes
320,1610420077,MKR is ridiculously undervalued,48,0,admin_default
321,1610035941,"Looking to invest a few thousand, I'm torn between ETH and BTC...",20,0,RumpleFORSKINNNN
322,1610023960,South Korean Gaming Titan to Buy Bitcoin Exchange Bithumb for $460M,0,0,blessive
323,1610019270,South Korean Gaming Titan to Buy Bitcoin Exchange Bithumb for $460M,2,0,TheGreatCryptopo
324,1607011332,North America Gets Its First Enterprise-Grade Bitcoin Mining Pool from Titan,0,0,patrickstar466
325,1606361620,"Hardware why, why not?",3,0,volatileutopia
326,1606292272,How do you like ELLIPAL TITAN? or which Hardware wallet would you recommend?,0,0,Raylin418
327,1592760381,10 famous cryptocurrency quotes and what we can learn from them - read and don't look like a fool anymore :P,40,0,alvarosb
328,1592264760,Media Titan w/ Over 144 Million Readers Tests Ripple-Backed Coil for Web Monetization. Good for XRP?,2,0,The-Crypto-Portal
329,1580883073,Ellipal Titan Discount Coupon Code [10% Off],0,0,coinfunda
330,1575271957,Titan Blockchain Explorer Version 2,0,0,travelniceindia
331,1572999497,"#BTC Per a November 4, 2019, statement from Huawei’s WeChat channel, the multinational telecom titan has signed a strategic cooperation agreement with the Peopl...Read more: https://t.co/DINYrwX8uH",1,0,webnowcompany
332,1568875585,"#BTC Crypto exchange Titan, Binance, and Jihan Wu’s Matrixport have joined in on a $200 million Series B round for Mars Finance: a Chinese media firm that aims ...Read more: https://t.co/kxQsKv8N9Z",0,0,webnowcompany
333,1568375456,“EuroCoin” vs. The Tech Titan “Libra”? Let the fight begin. French Finance Minister Bruno Le Maire has said that Europe should consider its own “public digital currency” that could challenge Facebook’s Libra.,15,0,TCR_Roberts
334,1568364966,Things To Know Before Using Huobi,0,0,hunnykaushal3
335,1561629983,"Looking to buy some cryptocurrencies, is it a good time?",0,0,shalinimittal
336,1560846580,What are your opinions about TTN?,0,0,svenhdtv
337,1558698806,What do you think about the TTN project?,0,0,svenhdtv
338,1557929843,Earn money for your Blockchain Research - INTChain Titan Plan,1,0,kalpash
